Fourth Grade - n mechanical pencils nlease,mechanical pencils,Multiple
Pencils Pencil Pouch for 3mmg binder Dry Erase Markers-4pkg. (2) Glue Sticks
3 inch 3 -ring binder or Trapper Keeper [w/zipper if possible),inch ring binder Trapper Keeper zipper possible,3
"Pencil Pouch for 3 -Ring Binder (2) Composition Notebooks (Please, not Spiral Bound)",Pencil Pouch,1
Pkg. 5 divider tabs with pockets (please make sure there are pockmal) (5) Loose leaf notebook papa
Pencil -Top Erasers Colored pencils Book bag (no wheels) Markers Scissors,Pencil Top Erasers Colored pencils Book bag Markers Scissors,Multiple
(1)Headphones/Earbods Small Pencil Boa,Headphones Small Pencil Boa,Multiple
